{
  "specversion": "1.0",
  "id": "01900000-0000-7000-8000-000000000012",
  "source": "https://platform93.example",
  "type": "resource.updated",
  "contract_source": "platform93",
  "subject": "resource/01900000-0000-7000-8000-000000000004",
  "time": "2026-10-18T10:01:00Z",
  "application_id": "01900000-0000-7000-8000-000000000002",
  "schema_version": "1.0",
  "data": { "resource_id": "01900000-0000-7000-8000-000000000004", "version": 2 }
}
